{
  "$schema": "https://json-schema.org/draft/2020-12/schema",
  "$id": "https://lmpc.local/schema/rule_pack.schema.json",
  "title": "RulePack",
  "type": "object",
  "additionalProperties": false,
  "required": [
    "id", "effective_from", "gazettes", "checks", "table_i",
    "mrp_wording", "exceptions"
  ],
  "properties": {
    "id": { "type": "string", "pattern": "^lmpc\\.v[0-9]{4}_[0-9]{2}$" },
    "effective_from": { "type": "string", "format": "date" },
    "gazettes": {
      "type": "array",
      "items": {
        "type": "object",
        "additionalProperties": false,
        "required": ["citation", "date"],
        "properties": {
          "citation": { "type": "string" },
          "date": { "type": "string", "format": "date" }
        }
      }
    },
    "checks": {
      "type": "array",
      "minItems": 1,
      "items": {
        "type": "string",
        "enum": [
          "presence", "format_mrp", "format_usp", "table_i", "width",
          "isolation", "contrast", "language", "listing_6_10",
          "listing_6_10a", "dual_mrp"
        ]
      }
    },
    "table_i": { "type": "object" },
    "mrp_wording": {
      "type": "object",
      "additionalProperties": false,
      "required": ["allowed_substrings"],
      "properties": {
        "allowed_substrings": { "type": "array", "items": { "type": "string" } }
      }
    },
    "exceptions": {
      "type": "array",
      "items": {
        "type": "object",
        "additionalProperties": false,
        "required": ["id", "skips_rule_ids"],
        "properties": {
          "id": { "type": "string" },
          "skips_rule_ids": { "type": "array", "items": { "type": "string" } },
          "when": { "type": "object" }
        }
      }
    }
  }
}
